Question,Topic
There is no such thing as luck. People determine their own lives. Do you agree?,Reflective
The only worthwhile form of discipline is self-discipline. Discuss.,Reflective
Is friendly rivalry ever possible?,Reflective
People today do not work as hard as they did in the past. How true is this of your society?,Work and Life
"In an age of rapid technological advancement, is a single career for life realistic?",Work and Life
Practical ability is just as important as intellectual skills. How far is this true in your society?,Work and Life
People who do the most worthwhile jobs rarely receive the best financial rewards. To what extent is this true of your society?,Work and Life
How far should firms be allowed to limit their workers' rights when profits are at stake?,Work and Life
Consider the view that some careers are better suited to one gender than the other.,Work and Life
"Consider the view that most work these days could, and should, be done from home.",Work and Life
"Instead of speeding up the pace of life, we should be slowing it down. What do you think?",Work and Life
Do you agree that city life is becoming increasingly unattractive?,Work and Life
The family has suffered at the expense of career in Singaporean society. Is this a fair comment?,Work and Life
Assess the importance of food within Singaporean culture.,Singapore
Many developed countries are paying increasing attention to the needs of the disadvantaged. How far is this true in Singapore?,Singapore
How important is a sense of history in shaping the future of Singapore's society?,Singapore
Do myths and legends still have a role to play in Singapore?,Singapore
"Do the arts, such as music and literature, really play a significant role in Singaporean society?",Singapore
The tourist does not see the country the inhabitants know. How far is this true of Singapore?,Singapore
How far do magazines or television programmes aimed at young people in Singapore have a positive effect?,Singapore
To what extent are the young in Singapore favoured at the expense of the elderly?,Singapore
How far can the needs of minorities be met in modern Singapore?,Singapore
Was life for young people in Singapore better in the past than it is today?,Singapore
The family has suffered at the expense of career in Singaporean society. Is this a fair comment?,Singapore
"We shape our buildings, but then our buildings shape us. To what extent is this true of your society?",Society
To what extent can any society claim to be great?,Society
To what extent should income equality be a goal in your society?,Society
Religion is an important part of the lives of young people today. Consider whether this is true in your society.,Society
People today do not work as hard as they did in the past. How true is this of your society?,Society
To what extent is sporting achievement given adequate recognition in your society?,Society
Practical ability is just as important as intellectual skills. How far is this true in your society?,Society
Examine the role of music in establishing a national identity in your society.,Society
"In your society, to what extent is it acceptable for public money to be used for the acquisition of works of art?",Society
People who do the most worthwhile jobs rarely receive the best financial rewards. To what extent is this true of your society?,Society
Assess the view that traditional buildings have no future in your society.,Society
How effectively is public health promoted and managed in your society?,Society
"In your society, how well are the demands of the economy and the environment balanced?",Society
To what extent should the arts in your society focus on local rather than foreign talent?,Society
Traditional marriage is an outdated concept. To what extent is this true of your society?,Society
"For the majority of people, the Arts are irrelevant to their daily lives. How true is this of your society?",Society
How far is increased prosperity for all a realistic goal in your society?,Society
"How far, in your society, should unpopular views be open to discussion?",Society
To what extent are the rights of animals protected in your society?,Society
"In your society, how far is equality for all a reality?",Society
Only modern architecture and modern art have a place in today's world. How true is this of your society?,Society
In the digital age do newspapers still have a role in your society?,Society
"Would it matter if all the performing arts venues in your society, such as concert halls and theatres, were closed down?",Society
How important is it for people in your society to retain a sense of tradition?,Society
To what extent has technology had an impact on both privacy and security in your country?,Society
Assess the impact of foreign films or foreign TV programmes on the culture of your society.,Society
To what extent is design important in your society?,Society
Mass production inevitably means a loss of craftsmanship and quality. Is this true in your society?,Society
How far is your country prepared for future crises?,Society
To what extent do young people in your society take an interest in politics?,Society
Have multi-national businesses had a positive or negative impact on your society?,Society
To what extent are people judged more by their physical appearance than by their abilities?,Miscellaneous
Is there any point in trying to predict future trends?,Miscellaneous
Can humour ever be serious?,Miscellaneous
Do awards and prizes serve any useful purpose?,Miscellaneous
Far too much attention is given to beauty products and treatments. Do you agree?,Miscellaneous
